{
  "$schema": "https://json-schema.org/draft/2020-12/schema",
  "$id": "https://ai4learning.local/schemas/learning-artifact-v0.2.json",
  "title": "ai4learning LearningArtifact v0.2",
  "type": "object",
  "additionalProperties": false,
  "required": [
    "schema_version",
    "kind",
    "id",
    "created_at",
    "renderer",
    "title",
    "concept_ids",
    "learning_goal",
    "inference_prompt",
    "success_evidence",
    "authored_by",
    "prediction",
    "payload"
  ],
  "properties": {
    "schema_version": { "const": "0.2" },
    "kind": { "const": "learning-artifact" },
    "id": { "type": "string", "pattern": "^art_[A-Za-z0-9][A-Za-z0-9_-]{2,127}$" },
    "created_at": { "type": "string", "minLength": 1 },
    "renderer": { "const": "frequency_tree_v1" },
    "title": { "type": "string", "minLength": 1 },
    "concept_ids": {
      "type": "array",
      "minItems": 1,
      "uniqueItems": true,
      "items": { "type": "string", "minLength": 1 }
    },
    "learning_goal": { "type": "string", "minLength": 1 },
    "inference_prompt": { "type": "string", "minLength": 1 },
    "success_evidence": { "type": "string", "minLength": 1 },
    "authored_by": { "type": "string", "minLength": 1 },
    "prediction": {
      "type": "object",
      "additionalProperties": false,
      "required": ["prompt", "options"],
      "properties": {
        "prompt": { "type": "string", "minLength": 1 },
        "options": {
          "type": "array",
          "minItems": 2,
          "maxItems": 5,
          "items": {
            "type": "object",
            "additionalProperties": false,
            "required": ["id", "label"],
            "properties": {
              "id": { "type": "string", "pattern": "^[a-z][a-z0-9_-]{0,31}$" },
              "label": { "type": "string", "minLength": 1 }
            }
          }
        }
      }
    },
    "payload": {
      "type": "object",
      "additionalProperties": false,
      "required": [
        "population",
        "prevalence",
        "sensitivity",
        "false_positive_rate",
        "prevalence_min",
        "prevalence_max",
        "prevalence_step",
        "labels"
      ],
      "properties": {
        "population": { "type": "integer", "minimum": 100, "maximum": 1000000 },
        "prevalence": { "type": "number", "minimum": 0, "maximum": 1 },
        "sensitivity": { "type": "number", "minimum": 0, "maximum": 1 },
        "false_positive_rate": { "type": "number", "minimum": 0, "maximum": 1 },
        "prevalence_min": { "type": "number", "minimum": 0, "maximum": 1 },
        "prevalence_max": { "type": "number", "minimum": 0, "maximum": 1 },
        "prevalence_step": { "type": "number", "exclusiveMinimum": 0, "maximum": 1 },
        "labels": {
          "type": "object",
          "additionalProperties": false,
          "required": ["population", "condition", "complement", "positive", "false_positive"],
          "properties": {
            "population": { "type": "string", "minLength": 1 },
            "condition": { "type": "string", "minLength": 1 },
            "complement": { "type": "string", "minLength": 1 },
            "positive": { "type": "string", "minLength": 1 },
            "false_positive": { "type": "string", "minLength": 1 }
          }
        }
      }
    }
  }
}
